graph_order,acronym,name,DHBA_name,DHBA_acronym,DHBA_id,color_hex_triplet,uDHBA_id,r,g,b,a,vis,msh,acronym
950,3Do,dorsal oculomotor nucleus,dorsal oculomotor nucleus,3D,DHBA:12202,#478599,1310,0,128,128,1,1,1,3Do
951,3Me,medial oculomotor nucleus,medial oculomotor nucleus,3M,DHBA:12204,#478599,1311,230,25,75,1,1,1,3Me
952,3Ve,ventral oculomotor nucleus,ventral oculomotor nucleus,3Vn,DHBA:12205,#478599,1312,128,128,0,1,1,1,3Ve
953,I3,interoculomotor nucleus,interoculomotor nucleus,I3,DHBA:12203,#478599,1313,0,0,128,1,1,1,I3
954,4N,trochlear nucleus,trochlear nucleus,4N,DHBA:12206,#478599,341,2,98,151,1,1,1,4N
955,PAGR,periaqueductal gray region,,,DHBA:AA30359,,1314,250,190,212,1,1,1,PAGR
956,PAG,periaqueductal gray substance,periaqueductal gray substance,PAG,DHBA:12209,#8EBDCD,345,236,39,58,1,1,1,PAG
957,PAGdm,"periaqueductal gray substance,dorsomedial division","periaqueductal gray substance,dorsomedial division",PAGdm,DHBA:12211,#56A1BB,1315,70,240,240,1,1,1,PAGdm
958,PAGdl,"periaqueductal gray substance, dorsolateral division","periaqueductal gray substance, dorsolateral division",PAGdl,DHBA:12212,#56A1BB,1316,170,110,40,1,1,1,PAGdl
959,PAGl,"periaqueductal gray substance, lateral division","periaqueductal gray substance, lateral division",PAGl,DHBA:12213,#56A1BB,1317,170,110,40,1,1,1,PAGl
960,PAGvl,"periaqueductal gray substance, ventrolateral division","periaqueductal gray substance, ventrolateral division",PAGvl,DHBA:12214,#56A1BB,1318,70,240,240,1,1,1,PAGvl
961,PAGpl,"periaqueductal gray substance, pleioglial division","periaqueductal gray substance, pleioglial division",PAGpl,DHBA:12215,#56A1BB,1319,255,250,200,1,1,1,PAGpl
962,Lth,lithoid nucleus,lithoid nucleus,Lth,DHBA:15548,#56A1BB,1320,220,190,255,1,1,1,Lth
963,PrC,precommissural nucleus,precommissural nucleus,PrC,DHBA:12287,#5298AE,1321,0,130,200,1,1,1,PrC
964,SCO,subcommissural organ,subcommissural organ,SCO,DHBA:12101,#87281A,1322,0,128,128,1,1,1,SCO
965,Me5,mesencephalic trigeminal nucleus,mesencephalic trigeminal nucleus,Me5,DHBA:12208,#4D8DA3,344,148,35,240,1,1,1,Me5
966,SPAR,subperiaqueductal region of midbrain,,,DHBA:AA30360,,1323,128,128,0,1,1,1,SPAR
967,DRca,cap of dorsal raphe nucleus,cap of dorsal raphe nucleus,DRc,DHBA:12217,#5298AE,1324,70,240,240,1,1,1,DRca
968,Dk,nucleus of Darkschewitsch,nucleus of Darkschewitsch,Dk,DHBA:12218,#5298AE,1325,255,250,200,1,1,1,Dk
969,PC3,parvicellular oculomotor nucleus,parvicellular oculomotor nucleus,PC3,DHBA:12219,#5298AE,1326,250,190,212,1,1,1,PC3
970,Su3C,supraoculomotor cap,supraoculomotor cap,Su3C,DHBA:12220,#5298AE,1327,128,128,0,1,1,1,Su3C
971,Su3,supraoculomotor nucleus,supraoculomotor nucleus,Su3,DHBA:12221,#5298AE,1328,0,130,200,1,1,1,Su3
972,S4N,supratrochlear nucleus,supratrochlear nucleus,S4N,DHBA:13235,#478599,342,104,111,154,1,1,1,S4N
973,MA3,medial accessory oculomotor nucleus,medial accessory oculomotor nucleus,MA3,DHBA:12280,#56A1BB,1329,128,128,128,1,1,1,MA3
974,MRa,raphe nuclei in midbrain,midbrain raphe nuclei,MRa,DHBA:12222,#7EB3C9,348,81,179,187,1,1,1,MRa
975,DR,dorsal raphe nucleus,dorsal raphe nucleus,DR,DHBA:12223,#6CA9BF,349,141,44,16,1,1,1,DR
976,DRC,"dorsal raphe nucleus, caudal part","dorsal raphe nucleus, caudal part",DRC,DHBA:12224,#5298AE,1330,128,128,128,1,1,1,DRC
977,DRD,"dorsal raphe nucleus, dorsal part","dorsal raphe nucleus, dorsal part",DRD,DHBA:12225,#5298AE,1331,128,128,0,1,1,1,DRD
978,DRI,"dorsal raphe nucleus, interfascicular part","dorsal raphe nucleus, interfascicular part",DRI,DHBA:12226,#5298AE,1332,145,30,180,1,1,1,DRI
979,DRL,"dorsal raphe nucleus, lateral part","dorsal raphe nucleus, lateral part",DRL,DHBA:12227,#5298AE,1333,70,240,240,1,1,1,DRL
980,DRV,"dorsal raphe nucleus, ventral part","dorsal raphe nucleus, ventral part",DRV,DHBA:12228,#5298AE,1334,145,30,180,1,1,1,DRV
981,DRVL,"dorsal raphe nucleus, ventrolateral part","dorsal raphe nucleus, ventrolateral part",DRVL,DHBA:12229,#5298AE,1335,60,180,75,1,1,1,DRVL
982,PDR,posterodorsal raphe nucleus,posterodorsal raphe nucleus,PDR,DHBA:12237,#56A1BB,355,215,61,7,1,1,1,PDR
983,LiN,linear nucleus of the midbrain,linear nucleus of the midbrain,Lin,DHBA:12230,#56A1BB,350,255,225,25,1,1,1,LiN
984,RliR,rostral linear nucleus of the raphe,rostral linear nucleus of the raphe,RLin,DHBA:12234,#5298AE,352,145,30,180,1,1,1,RliR
985,CLiR,caudal linear nucleus of the raphe,,,DHBA:AA30361,,1336,0,130,200,1,1,1,CLiR
986,CLiAz,"caudal linear nucleus of the raphe, azygos part",,,DHBA:AA30362,,1337,245,130,48,1,1,1,CLiAz
987,CLiZ,"caudal linear nucleus of the raphe, zygos part","caudal linear nucleus of the raphe, zygos part",CLinZ,DHBA:12233,#5298AE,1338,0,128,128,1,1,1,CLiZ
988,MCc,central cell groups in midbrain,,,DHBA:AA30363,,1339,0,0,128,1,1,1,MCc
989,RN,red nucleus,red nucleus,RN,DHBA:12247,#6CA9BF,359,30,207,255,1,1,1,RN
990,RNdm,"red nucleus, dorsomedial part","red nucleus, dorsomedial part",RNdm,DHBA:12248,#5298AE,1340,245,130,48,1,1,1,RNdm
991,RNmc,"red nucleus, magnocellular part","red nucleus, magnocellular part",RNmc,DHBA:12249,#4D8DA3,1341,0,0,128,1,1,1,RNmc
992,RNpc,"red nucleus, parvicellular part","red nucleus, parvicellular part",RNpc,DHBA:12250,#56A1BB,1342,255,215,180,1,1,1,RNpc
993,PRu,perirubral region of central cell groups,,,DHBA:AA30364,,1343,250,190,212,1,1,1,PRu
994,PrR,prerubral regions,,,DHBA:AA30365,,1344,0,128,128,1,1,1,PrR
995,RRF,retrorubral field,retrorubral field,RRF,DHBA:12289,#5298AE,1345,145,30,180,1,1,1,RRF
996,RR,retrorubral nucleus,,,DHBA:AA30366,,1346,255,215,180,1,1,1,RR
997,DA8,A8 dopamine cell group,caudal portion of DFC (area 8),A8,DHBA:10174,#D4B235,1347,230,25,75,1,1,1,DA8
998,PaR,pararubral nucleus,,,DHBA:AA30367,,1348,128,128,0,1,1,1,PaR
999,MVC,ventral cell groups in midbrain,,,DHBA:AA30368,,1349,0,0,128,1,1,1,MVC
1000,SN,substantia nigra,substantia nigra,SN,DHBA:12251,#6CA9BF,360,62,29,203,1,1,1,SN
1001,SNC,"substantia nigra, compact part","substantia nigra, compact part",SNC,DHBA:12252,#43808F,1350,230,25,75,1,1,1,SNC
1002,SNCd,"substantia nigra, compact part, dorsal subdivision","substantia nigra, compact part, dorsal subdivision",SNCd,DHBA:12253,#43808F,1351,60,180,75,1,1,1,SNCd
1003,SNCm,"substantia nigra, compact part, medial subdivision","substantia nigra, compact part, medial subdivision",SNCm,DHBA:12254,#43808F,1352,128,128,0,1,1,1,SNCm
1004,SNCv,"substantia nigra, compact part, ventral subdivision","substantia nigra, compact part, ventral subdivision",SNCv,DHBA:12255,#43808F,1353,145,30,180,1,1,1,SNCv
1005,SNR,"substantia nigra, reticular part","substantia nigra, reticular part",SNR,DHBA:12259,#6CA9BF,1354,255,215,180,1,1,1,SNR
1006,SNL,"substantia nigra, lateral part","substantia nigra, lateral part",SNL,DHBA:12257,#478599,1355,128,128,128,1,1,1,SNL
1007,SNM,"substantia nigra, medial Part",,,DHBA:AA30369,,1356,240,50,230,1,1,1,SNM
1008,MTN,medial terminal nucleus of accessory nucleus of optic tract ,"accessory nuclei of optic tract, medial nucleus",AOPm,DHBA:12193,#6CA9BF,1357,255,225,25,1,1,1,MTN
1009,VTR,ventral tegmental region of midbrain,ventral tegmental region of midbrain,VTR,DHBA:146034938,#8EBDCD,361,0,114,37,1,1,1,VTR
1010,VTA,ventral tegmental area,ventral tegmental area,VTA,DHBA:12261,#7EB3C9,1358,230,25,75,1,1,1,VTA
1011,IF,interfascicular nucleus,interfascicular nucleus,IF,DHBA:12262,#56A1BB,1359,255,225,25,1,1,1,IF
1012,PBP,parabrachial pigmented nucleus,parabrachial pigmented nucleus,PBP,DHBA:12263,#56A1BB,1360,240,50,230,1,1,1,PBP
1013,PIF,parainterfascicular nucleus,parainterfascicular nucleus,PIF,DHBA:12264,#56A1BB,1361,240,50,230,1,1,1,PIF
1014,PaN,paranigral nucleus,paranigral nucleus,PaN,DHBA:12265,#5298AE,1362,145,30,180,1,1,1,PaN
1015,IP,interpeduncular nucleus,interpeduncular nucleus,IP,DHBA:12270,#8EBDCD,362,70,94,82,1,1,1,IP
1016,IPap,"interpeduncular nucleus, apical sudivision","interpeduncular nucleus, apical subnucleus",IPa,DHBA:12271,#6CA9BF,1363,210,245,60,1,1,1,IPap
1017,IPc,"interpeduncular nucleus, caudal subdivision","interpeduncular nucleus, caudal subnucleus",IPc,DHBA:12272,#6CA9BF,1364,0,130,200,1,1,1,IPc
1018,IPdm,"interpeduncular nucleus, dorsomedial subdivision","interpeduncular nucleus, dorsomedial subnucleus",IPdm,DHBA:12273,#6CA9BF,1365,245,130,48,1,1,1,IPdm
1019,IPi,"interpeduncular nucleus, intermediate subdivision","interpeduncular nucleus, intermediate subnucleus",IPi,DHBA:12274,#6CA9BF,1366,0,130,200,1,1,1,IPi
1020,IPl,"interpeduncular nucleus, lateral subdivision","interpeduncular nucleus, lateral subnucleus",IPl,DHBA:12275,#6CA9BF,1367,255,225,25,1,1,1,IPl
1021,IPr,"interpeduncular nucleus, rostral subdivision","interpeduncular nucleus, apical subnucleus",IPa,DHBA:12271,#6CA9BF,1368,128,0,0,1,1,1,IPr
1022,MLC,lateral cell groups in midbrain,,,DHBA:AA30370,,1369,250,190,212,1,1,1,MLC
1023,PaL,paralemniscal nucleus,paralemniscal nucleus,PLN,DHBA:12495,#517DBE,1370,128,128,128,1,1,1,PaL
1024,PBG,parabigeminal nucleus,parabigeminal nucleus,PBG,DHBA:12312,#5298AE,1371,128,0,0,1,1,1,PBG
1025,MiTg,microcellular tegmental nucleus,microcellular tegmental nucleus,MiTg,DHBA:12281,#6CA9BF,1372,145,30,180,1,1,1,MiTg
1026,Sag,sagulum nucleus (nucleus sagulum),sagulum nucleus,Sag,DHBA:12313,#56A1BB,1373,255,225,25,1,1,1,Sag
1027,SbB,subbrachial nucleus,subbrachial nucleus,SubB,DHBA:12290,#5298AE,1374,255,225,25,1,1,1,SbB
1028,LTN,lateral terminal nucleus of accessory nucleus of optic tract ,"accessory nuclei of optic tract, lateral nucleus",AOPl,DHBA:12192,#6CA9BF,1375,128,0,0,1,1,1,LTN
1029,MRF,midbrain reticular formation,midbrain reticular formation,MRF,DHBA:12239,#56A1BB,358,152,206,71,1,1,1,MRF
1030,CnF,cuneiform nucleus,cuneiform nucleus,CnF,DHBA:12240,#56A1BB,1376,128,128,128,1,1,1,CnF
1031,CnFd,dorsal part of cuneiform nucleus,,,DHBA:AA30371,,1377,220,190,255,1,1,1,CnFd
1032,CnFv,ventral aprt of cuneiform nucleus,,,DHBA:AA30372,,1378,255,225,25,1,1,1,CnFv
1033,PrCnF,precuneiform area,precuneiform area,PrCnF,DHBA:12241,#56A1BB,1379,128,128,128,1,1,1,PrCnF
1034,U-mb,nucleus U of midbrain,nucleus U,U,DHBA:12242,#56A1BB,1380,170,110,40,1,1,1,U-mb
1035,PTg,pedunculo(pontine) tegmental  nucleus,pedunculo(pontine) tegmental  nucleus,PTg,DHBA:12243,#5298AE,1381,255,215,180,1,1,1,PTg
1036,PTgC,"pedunculo(pontine) tegmental  nucleus, compact part","pedunculo(pontine) tegmental  nucleus, compact part",PTgC,DHBA:12244,#5298AE,1382,245,130,48,1,1,1,PTgC
1037,PTgD,"pedunculo(pontine) tegmental  nucleus, dissipated part","pedunculo(pontine) tegmental  nucleus, dissipated part",PTgD,DHBA:12245,#5298AE,1383,0,0,128,1,1,1,PTgD
1038,SCnF,subcuneiform nucleus,subcuneiform nucleus,SubCn,DHBA:12246,#56A1BB,1384,230,25,75,1,1,1,SCnF
1039,PaC,paracollicular tegmentum,paracollicular tegmentum,PaC,DHBA:12282,#6CA9BF,1385,128,0,0,1,1,1,PaC
1040,INPC,interstitial nucleus of posterior commissure (PCom),interstitial nucleus of posterior commissure,INPC,DHBA:12194,#56A1BB,1386,0,128,128,1,1,1,INPC
1041,MCPC,magocellular nucleus of posterior commissure,magnocellular nucleus of the posterior commissure,MCPC,DHBA:12279,#56A1BB,1387,128,128,128,1,1,1,MCPC
1042,InC,interstitial nucleus of Cajal,interstitial nucleus of Cajal,InC,DHBA:12278,#5298AE,1388,128,0,0,1,1,1,InC
1043,InCco,core of interstitial nucleus of Cajal,,,DHBA:AA30373,,1389,0,128,128,1,1,1,InCco
1044,InCsh,shell of interstitial nucleus of Cajal,,,DHBA:AA30374,,1390,255,225,25,1,1,1,InCsh
1045,Pa4,paratrochlear nucleus,paratrochlear nucleus,Pa4,DHBA:12284,#56A1BB,1391,255,250,200,1,1,1,Pa4
1046,MTgX,uncharted region in midbrain tegmentum,,,DHBA:AA30375,,1392,70,240,240,1,1,1,MTgX
1047,MBDe,developing transient structures of midbrain,,,DHBA:AA30376,,1393,145,30,180,1,1,1,MBDe
1048,MZM,marginal zone of midbrain,marginal zone of midbrain,MZM,DHBA:12326,#CDBABA,1394,170,255,195,1,1,1,MZM
1049,IZM,intermediate (mantal) zone of midbrain,intermediate (mantle) zone of midbrain,IZM,DHBA:12319,#9C8383,1395,170,110,40,1,1,1,IZM
1050,IZMro,roof plate of midbrain,roof plate of midbrain,IZMro,DHBA:12320,#937B7C,1396,128,128,0,1,1,1,IZMro
1051,IZMal,alar plate (tectal zone) of midbrain,alar plate (tectal zone) of midbrain,IZMal,DHBA:12321,#937B7C,1397,255,250,200,1,1,1,IZMal
1052,IZMba,basal plate of midbrain,basal plate of midbrain,IZMba,DHBA:12322,#937B7C,1398,0,128,128,1,1,1,IZMba
1053,IZMfl,floor plate of midbrain,floor plate of midbrain,IZMfl,DHBA:12325,#9C8383,1399,145,30,180,1,1,1,IZMfl
1054,VZM,ventricular (matrix) zone of midbrain,ventricular (matrix) zone of midbrain,VZM,DHBA:12318,#81696B,1400,210,245,60,1,1,1,VZM
1055,HB,hindbrain (rhombencephalon),hindbrain (rhombencephalon),H,DHBA:10653,#CAD7EE,383,230,25,75,1,1,1,HB
1056,HBSe,segmentation of hindbrain,,,DHBA:AA30377,,1401,60,180,75,1,1,1,HBSe
1057,Met,metencephalon,metencephalon,Met,DHBA:10655,#B3C8E7,385,171,69,68,1,1,1,Met
1058,CB,cerebellum,cerebellum,CB,DHBA:10656,#9EBAE1,386,183,77,46,1,1,1,CB
1059,CBC,cerebellar cortex,cerebellar cortex,CBC,DHBA:10657,#89ADDB,387,206,181,251,1,1,1,CBC
1060,CBD,divisions (lobes) of cerebellar cortex,,,DHBA:AA30378,,1402,255,225,25,1,1,1,CBD
1061,ACb,anterior lobe of cerebellar cortex,anterior lobe,ACb,DHBA:12838,#4A8ECC,1403,220,190,255,1,1,1,ACb
1062,ACV,"anterior lobe, vermis part",,,DHBA:AA30379,,1404,255,225,25,1,1,1,ACV
1063,CV1,lobule I (lingula),,,DHBA:AA30380,,1405,0,130,200,1,1,1,CV1
1064,CV2-3,lobule II-III (central lobule),,,DHBA:AA30381,,1406,255,250,200,1,1,1,CV2-3
1065,CV2,"lobule II (central lobule, rostral part)",,,DHBA:AA30382,,1407,128,128,128,1,1,1,CV2
1066,CV3,"lobule III (central lobule, caudal part)",,,DHBA:AA30383,,1408,250,190,212,1,1,1,CV3
1067,CV4-5,Lobule IV-V (culmen),,,DHBA:AA30384,,1409,245,130,48,1,1,1,CV4-5
1068,CV4,"lobule IV (culmen, rostral part)",,,DHBA:AA30385,,1410,220,190,255,1,1,1,CV4
1069,CV5,"lobule V (culmen, caudal part)",,,DHBA:AA30386,,1411,245,130,48,1,1,1,CV5
1070,ACH,"anterior lobe, hemisphere part",,,DHBA:AA30387,,1412,145,30,180,1,1,1,ACH
1071,CH2-3,lobule II-III (wing of central lobule),,,DHBA:AA30388,,1413,255,250,200,1,1,1,CH2-3
1072,CH2,"lobule II (wing of central lobule, rostral part)",,,DHBA:AA30389,,1414,170,255,195,1,1,1,CH2
1073,CH3,"lobule III (wing of central lobule, caudal part)",,,DHBA:AA30390,,1415,250,190,212,1,1,1,CH3
1074,CH4-5,Lobule IV-V (quadrangular lobule),,,DHBA:AA30391,,1416,255,225,25,1,1,1,CH4-5
1075,CH4,"lobule IV (quadrangular lobule, rostral part)",,,DHBA:AA30392,,1417,0,130,200,1,1,1,CH4
1076,CH5,"lobule V (quadrangular lobule, caudal part)",,,DHBA:AA30393,,1418,255,250,200,1,1,1,CH5
1077,PCb,posterior lobe of cerebellar cortex,posterior lobe,PCb,DHBA:12844,#3E80BA,1419,0,130,200,1,1,1,PCb
1078,PCV,"posterior lobe, vermis part",,,DHBA:AA30394,,1420,210,245,60,1,1,1,PCV
1079,CV6,lobule VI (declive),,,DHBA:AA30395,,1421,255,225,25,1,1,1,CV6
1080,CV6a,"lobule VIA (declive, rostral part)",,,DHBA:AA30396,,1422,210,245,60,1,1,1,CV6a
1081,CV6b,"Lobule VIB (declive, caudal part)",,,DHBA:AA30397,,1423,70,240,240,1,1,1,CV6b
1082,CV7,lobule VII (folium and tuber),,,DHBA:AA30398,,1424,250,190,212,1,1,1,CV7
1083,CV7a,lobule VIIA-folium and tuber,,,DHBA:AA30399,,1425,0,130,200,1,1,1,CV7a
1084,CV7a1,lobule VIIAf (folium),,,DHBA:AA30400,,1426,170,110,40,1,1,1,CV7a1
1085,CV7a2,"lobule VIIAt (tuber, part 1)",,,DHBA:AA30401,,1427,145,30,180,1,1,1,CV7a2
1086,CV7b,"lobule VIIB (tuber, part 2)",,,DHBA:AA30402,,1428,245,130,48,1,1,1,CV7b
1087,CV8,Lobule VIII (pyramis),,,DHBA:AA30403,,1429,230,25,75,1,1,1,CV8
1088,CV8a,"lobule VIIIA (pyramis, part 1)",,,DHBA:AA30404,,1430,255,225,25,1,1,1,CV8a
1089,CV8b,"lobule VIIIB (pyramis, part 2)",,,DHBA:AA30405,,1431,255,215,180,1,1,1,CV8b
1090,CV9,lobule IX (uvula),,,DHBA:AA30406,,1432,0,128,128,1,1,1,CV9
1091,PCH,"posterior lobe, hemisphere part",,,DHBA:AA30407,,1433,145,30,180,1,1,1,PCH
1092,CH6,lobule VI (simple lobule),,,DHBA:AA30408,,1434,210,245,60,1,1,1,CH6
1093,CH6a,"lobule VIA (simple lobule, rostral part)",,,DHBA:AA30409,,1435,220,190,255,1,1,1,CH6a
1094,CH6b,"Lobule VIB (simple lobule, caudal part)",,,DHBA:AA30410,,1436,255,215,180,1,1,1,CH6b
1095,CH7,lobule VII (semilunar-gracile lobule),,,DHBA:AA30411,,1437,0,130,200,1,1,1,CH7
1096,CH7a,lobule VIIA (semilunar lobule/ansiform lobule),,,DHBA:AA30412,,1438,250,190,212,1,1,1,CH7a
1097,CH7a1,lobule VIIA/crus I (superior semilunar lobule),,,DHBA:AA30413,,1439,170,255,195,1,1,1,CH7a1
1098,CH7a2,lobule VIIA/crus II (inferior semilunar lobule),,,DHBA:AA30414,,1440,230,25,75,1,1,1,CH7a2
1099,CH7b,lobule VIIB (gracile lobule),,,DHBA:AA30415,,1441,128,0,0,1,1,1,CH7b
1100,CH8,Lobule VIII (biventral lobule),,,DHBA:AA30416,,1442,145,30,180,1,1,1,CH8
1101,CH8a,"lobule VIIIA (biventral lobule, part 1, paramedian lobule)",,,DHBA:AA30417,,1443,0,128,128,1,1,1,CH8a
1102,CH8b,"lobule VIIIB (biventral lobule, part 2, copula pyramis)",,,DHBA:AA30418,,1444,0,128,128,1,1,1,CH8b
1103,CH9,lobule IX (tonsil-paraflocculus),,,DHBA:AA30419,,1445,255,225,25,1,1,1,CH9
1104,CH9a,lobule IX (tonsil),,,DHBA:AA30420,,1446,250,190,212,1,1,1,CH9a
1105,CH9b,lobule IX (paraflocculus),,,DHBA:AA30421,,1447,255,215,180,1,1,1,CH9b
1106,FNCb,flocculonodular lobe of cerebellar cortex,flocculonodular lobe,FNCb,DHBA:12852,#3272AE,1448,255,225,25,1,1,1,FNCb
1107,CV10,"flocculonodular lobe, vermis part (lobule X-nodulus)",,,DHBA:AA30422,,1449,0,128,128,1,1,1,CV10
1108,CH10,"flocculonodular lobe, flocculus part",,,DHBA:AA30423,,1450,60,180,75,1,1,1,CH10
1109,CH10a,lobule X (flocculus),,,DHBA:AA30424,,1451,220,190,255,1,1,1,CH10a
1110,CH10b,Lobule X (accessory paraflocculus),,,DHBA:AA30425,,1452,60,180,75,1,1,1,CH10b
1111,CbL,layers of cerebellar cortex,,,DHBA:AA30426,,1453,255,225,25,1,1,1,CbL
1112,CbL1,molecular layer of cerebellar cortex,,,DHBA:AA30427,,1454,70,240,240,1,1,1,CbL1
1113,CbL2,Purkinje cell layer of cerebellar cortex,,,DHBA:AA30428,,1455,210,245,60,1,1,1,CbL2
1114,CbL3,granular cell layer of cerebellar cortex,,,DHBA:AA30429,,1456,240,50,230,1,1,1,CbL3
1115,CbDN,cerebellar deep nuclei,cerebellar deep nuclei,CbDN,DHBA:10660,#3E80BA,395,205,152,30,1,1,1,CbDN
1116,DT,dentate (lateral) nucleus,dentate (lateral) nucleus,DT,DHBA:12396,#19457E,396,208,76,181,1,1,1,DT
1117,DTlv,"dentate nucleus, lateroventral part","dentate nucleus, lateroventral part",DTlv,DHBA:12397,#19457E,1457,255,225,25,1,1,1,DTlv
1118,DTmd,"dentate nucleus, mediodorsal part","dentate nucleus, mediodorsal part",DTmd,DHBA:12398,#19457E,1458,230,25,75,1,1,1,DTmd
1119,InP,interpositus (intermediate) nucleus,interpositus (intermediate) nucleus,InP,DHBA:12399,#115A95,397,187,61,118,1,1,1,InP
1120,InPm,medial interpositus (globose) nucleus,medial interpositus (globose) nucleus,InPM,DHBA:12400,#115A95,1459,245,130,48,1,1,1,InPm
1121,InPl,lateral interpositus (emboliform) nucleus,lateral interpositus (emboliform) nucleus,InPL,DHBA:12401,#115A95,1460,255,250,200,1,1,1,InPl
1122,FAS,fastigial (medial) nucleus,fastigial (medial) nucleus,Fas,DHBA:12402,#3272AE,398,60,180,75,1,1,1,FAS
1123,FASm,"fastigial nucleus, medial part","fastigial nucleus, medial part",FasM,DHBA:12404,#3272AE,1461,210,245,60,1,1,1,FASm
1124,FASl,"fastigial nucleus, lateral part","fastigial nucleus, lateral part",FasL,DHBA:12403,#3272AE,1462,0,130,200,1,1,1,FASl
1125,BIcb,basal interstitial nucleus of cerebellum,basal interstitial nucleus of cerebellum,BIcb,DHBA:267499207,#19457E,1463,240,50,230,1,1,1,BIcb
1126,Pn,pons,pons,Pn,DHBA:10661,#AFC3DB,399,29,0,139,1,1,1,Pn
1127,LBSSe,segmentation of pons,,,DHBA:AA30430,,1464,230,25,75,1,1,1,LBSSe
1128,PnBa,basilar part of pons,basilar part of pons,PnBa,DHBA:12405,#7893C7,400,227,145,164,1,1,1,PnBa
1129,PN,pontine nucleus,pontine nucleus,PN,DHBA:12406,#6586BF,401,210,192,155,1,1,1,PN
1130,PNd,dorsal part of pontine nucleus,dorsal nucleus,PNd,DHBA:12407,#4E78B0,1465,128,0,0,1,1,1,PNd
1131,PNdl,dorsolateral part of pontine nucleus,dorsolateral nucleus,PNdl,DHBA:12408,#4E78B0,1466,0,0,128,1,1,1,PNdl
1132,PNdm,dorsomedial part of pontine nucleus,dorsomedial nucleus,PNdm,DHBA:12409,#4E78B0,1467,128,128,128,1,1,1,PNdm
1133,PNl,lateral part of pontine nucleus,lateral nucleus,PNl,DHBA:12410,#4E78B0,1468,128,0,0,1,1,1,PNl
1134,PNm,median part of pontine nucleus,median nucleus,PNm,DHBA:12411,#4E78B0,1469,220,190,255,1,1,1,PNm
1135,PNpa,paramedian part of pontine nucleus,paramedian nucleus,PNpar,DHBA:12412,#4E78B0,1470,0,0,128,1,1,1,PNpa
1136,PNpd,peduncular part of pontine nucleus,peduncular nucleus,PNped,DHBA:12413,#4E78B0,1471,0,128,128,1,1,1,PNpd
1137,PnTg,pontine tegmentum,pontine tegmentum,PnTg,DHBA:12416,#6586BF,402,77,55,166,1,1,1,PnTg
1138,PnCG,central gray region of pons,central gray of pons,PnCG,DHBA:146034964,#517DBE,1472,245,130,48,1,1,1,PnCG
1139,DTg,dorsal tegmental nucleus,dorsal tegmental nucleus,DTg,DHBA:12508,#517DBE,1473,210,245,60,1,1,1,DTg
1140,DTgC,"dorsal tegmental nucleus, central part","dorsal tegmental nucleus, central part",DTgC,DHBA:12509,#4E78B0,1474,70,240,240,1,1,1,DTgC
1141,DTgP,"dorsal tegmental nucleus, pericentral part","dorsal tegmental nucleus, pericentral part",DTgP,DHBA:12510,#4E78B0,1475,230,25,75,1,1,1,DTgP
1142,PDTg,posterodorsal tegmental nucleus,posterodorsal tegmental nucleus,PDTg,DHBA:12286,#5298AE,1476,255,250,200,1,1,1,PDTg
1143,LDTg,laterodorsal tegmental nucleus,laterodorsal tegmental nucleus,LDTg,DHBA:12519,#4E78B0,1477,60,180,75,1,1,1,LDTg
1144,LDTgD,dorsal part of laterodorsal tegmental nucleus,"laterodorsal tegmental nucleus, dorsal part",LDTgD,DHBA:12520,#4E78B0,1478,0,0,128,1,1,1,LDTgD
1145,LDTgV,ventral part of laterodorsal tegmental nucleus,"laterodorsal tegmental nucleus, ventral part",LDTgV,DHBA:12521,#4E78B0,1479,128,128,0,1,1,1,LDTgV
1146,DMTg,dorsomedial tegmental area,dorsomedial tegmental area,DMTg,DHBA:15557,#517DBE,1480,210,245,60,1,1,1,DMTg
1147,Bar,Barrington's nucleus,Barrington's nucleus,Bar,DHBA:12506,#517DBE,1481,255,250,200,1,1,1,Bar
1148,SPN,sphenoid nucleus,,,DHBA:AA30431,,1482,250,190,212,1,1,1,SPN
1149,NI,nucleus incertus,nucleus incertus,NI,DHBA:146034972,#6586BF,1483,170,110,40,1,1,1,NI
1150,NIM,medial part of nucleus incertus,,,DHBA:AA30432,,1484,170,255,195,1,1,1,NIM
1151,NIL,lateral part of nucleus incertus,,,DHBA:AA30433,,1485,0,0,128,1,1,1,NIL
1152,PnE,ependyma and subependymal layers of pons,ependyma and subependymal layers of pons,PnE,DHBA:146034968,#517DBE,1486,70,240,240,1,1,1,PnE
1153,PeG,periventricular gray of pons,central gray of pons,PnCG,DHBA:146034964,#517DBE,1487,170,255,195,1,1,1,PeG
1154,NC,nucleus coeruleus (locus coeruleus),nucleus coeruleus,NC,DHBA:12499,#3A5680,431,58,106,250,1,1,1,NC
1155,EpC,epicoeruleus nucleus,epicoeruleus nucleus,EpC,DHBA:12512,#517DBE,1488,128,0,0,1,1,1,EpC
1156,Me5-pn,"mesencephalic nucleus of trigeminal nerve, pontine part","mesencephalic nucleus of trigeminal nerve, pontine part",Me5-p,DHBA:12443,#476A9A,412,255,250,200,1,1,1,Me5-pn
1157,PnEN,efferent nuclei of cranial nerves in pons,efferent nuclei of cranial nerves in pons,PnEN,DHBA:12417,#4C72A8,403,72,47,47,1,1,1,PnEN
1158,6N,abducens nucleus,abducens nucleus,6N,DHBA:12418,#476A9A,404,89,140,56,1,1,1,6N
1159,SGe,supragenual nucleus,supragenual nucleus,SGe,DHBA:12662,#727CB6,1489,128,128,0,1,1,1,SGe
1160,7N,facial nucleus,facial nucleus,7N,DHBA:12420,#476A9A,406,75,248,204,1,1,1,7N
1161,7D,"facial nucleus, dorsal subnucleus","facial nucleus, dorsal subnucleus",7D,DHBA:12421,#406290,1490,220,190,255,1,1,1,7D
1162,7DI,"facial nucleus, dorsointermediate subnucleus",,,DHBA:AA30434,,1491,145,30,180,1,1,1,7DI
1163,7DM,"facial nucleus, dorsomedial subnucleus",,,DHBA:AA30435,,1492,128,128,128,1,1,1,7DM
1164,7I,"facial nucleus, intermediate subnucleus",,,DHBA:AA30436,,1493,220,190,255,1,1,1,7I
1165,7L,"facial nucleus, lateral subnucleus",,,DHBA:AA30437,,1494,70,240,240,1,1,1,7L
1166,7VI,"facial nucleus, ventrointermediate subnucleus","facial nucleus, ventrointermediate subnucleus",7VI,DHBA:12422,#406290,1495,170,110,40,1,1,1,7VI
1167,7VM,"facial nucleus, ventromedial subnucleus","facial nucleus, ventromedial subnucleus",7VM,DHBA:12424,#406290,1496,0,128,128,1,1,1,7VM
1168,7SH,"facial nucleus,stylohyoid part","facial nucleus,stylohyoid part",7SH,DHBA:15554,#406290,1497,255,215,180,1,1,1,7SH
1169,7VL,"facial nucleus, ventrolateral subnucleus","facial nucleus, ventrolateral subnucleus",7VL,DHBA:12427,#406290,1498,170,110,40,1,1,1,7VL
1170,PF7,perifacial zone,perifacial zone,PF7,DHBA:12425,#D1D7E8,1499,255,250,200,1,1,1,PF7
1171,Lac,lacrimal nucleus,lacrimal nucleus,Lac,DHBA:12428,#4C72A8,407,175,82,232,1,1,1,Lac
1172,SSV,superior salivatory nucleus,superior salivatory nucleus,SuSV,DHBA:12435,#476A9A,409,60,180,75,1,1,1,SSV
1173,PnLC,lateral cell groups of pons,lateral cell column of pons,LCCP,DHBA:12706,#8C7373,1500,210,245,60,1,1,1,PnLC
1174,5N,"motor nucleus of trigeminal nerve (motor trigeminal nucleus, Mo5)",motor nucleus of trigeminal nerve,Mo5,DHBA:12429,#476A9A,408,255,250,200,1,1,1,5N
1175,5Npt,"motor nucleus of trigeminal nerve, pterygoid part","motor nucleus of trigeminal nerve, lateral pterygoid part",Mo5lpt,DHBA:12430,#406290,1501,255,215,180,1,1,1,5Npt
1176,5Nma,"motor nucleus of trigeminal nerve, masseter part","motor nucleus of trigeminal nerve, masseter part",Mo5ma,DHBA:12431,#406290,1502,128,128,0,1,1,1,5Nma
1177,5Npc,"motor nucleus of trigeminal nerve, parvicellular part","motor nucleus of trigeminal nerve, medial pterygoid part",Mo5mpt,DHBA:12432,#406290,1503,240,50,230,1,1,1,5Npc
1178,5Nmy,"motor nucleus of trigeminal nerve, mylohyoid part","motor nucleus of trigeminal nerve, mylohyoid part",Mo5my,DHBA:12433,#406290,1504,255,225,25,1,1,1,5Nmy
1179,5Nte,"motor nucleus of trigeminal nerve, temporalis part","motor nucleus of trigeminal nerve, temporalis part",Mo5te,DHBA:12434,#406290,1505,128,128,128,1,1,1,5Nte
1180,5Nrd,"motor nucleus of trigeminal nerve, rostral digastric part",,,DHBA:AA30438,,1506,255,215,180,1,1,1,5Nrd
